{"limits":{"fuel":8,"max_depth":3},"links":[{"from":{"node":"*outer*","port":"request"},"kind":"data","to":{"node":"ingest","port":"request"}},{"from":{"node":"exec","port":"report"},"kind":"data","to":{"node":"publish","port":"report"}},{"from":{"node":"ingest","port":"parsed"},"kind":"data","to":{"node":"plan","port":"parsed"}},{"from":{"node":"plan","port":"plan"},"kind":"data","to":{"node":"exec","port":"plan"}},{"from":{"node":"publish","port":"receipt"},"kind":"data","to":{"node":"*outer*","port":"receipt"}}],"mas_id":"outer.root","nodes":[{"id":"exec","kind":"sub_mas","ports":{"in":["plan"],"out":["report"]},"sub_mas":"outer.exec_loop"},{"capabilities":["voice.read"],"id":"ingest","kind":"agent","ports":{"in":["request"],"out":["parsed"]}},{"capabilities":["plan.write"],"id":"plan","kind":"agent","ports":{"in":["parsed"],"out":["plan"]}},{"capabilities":["evidence.write"],"id":"publish","kind":"agent","ports":{"in":["report"],"out":["receipt"]}}],"schema_version":"recursive-mas/v0.1","sub_mas":[{"links":[{"from":{"node":"*outer*","port":"plan"},"kind":"data","to":{"node":"act","port":"plan"}},{"from":{"node":"act","port":"evidence"},"kind":"data","to":{"node":"verify","port":"evidence"}},{"from":{"node":"act","port":"next_plan"},"kind":"data","to":{"node":"verify","port":"next_plan"}},{"from":{"node":"loop","port":"report"},"kind":"data","to":{"node":"*outer*","port":"report"}},{"from":{"node":"verify","port":"pass"},"kind":"data","to":{"node":"*outer*","port":"report"}},{"from":{"node":"verify","port":"retry"},"guard":"retry","kind":"data","to":{"node":"loop","port":"plan"}}],"mas_id":"outer.exec_loop","nodes":[{"capabilities":["exec.run"],"id":"act","kind":"agent","ports":{"in":["plan"],"out":["evidence","next_plan"]}},{"id":"loop","kind":"self_recurse","ports":{"in":["plan"],"out":["report"]}},{"capabilities":["evidence.read"],"id":"verify","kind":"agent","ports":{"in":["evidence","next_plan"],"out":["pass","retry"]}}]}]}